{
  "schemaVersion": 1,
  "id": "kyne.ast-grep",
  "name": "AST-grep",
  "version": "1.0.0",
  "description": "Structural code search and rewrite with ast-grep for syntax-aware matching that is more precise than plain text search.",
  "kind": "cli",
  "compatibility": {
    "relai": ">=1.1.3 <2.0.0"
  },
  "publisher": {
    "name": "Kyne",
    "url": "https://github.com/Kyne0328"
  },
  "repository": "https://github.com/Kyne0328/rel-ai-extensions",
  "homepage": "https://ast-grep.github.io/",
  "permissions": [
    "workspace.read",
    "workspace.write",
    "command.execute"
  ],
  "requires": {
    "commands": [
      "sg",
      "ast-grep"
    ],
    "platforms": []
  },
  "entrypoints": {
    "skill": "SKILL.md",
    "command": "sg"
  },
  "install": {
    "type": "bundle",
    "artifacts": [
      {
        "platform": "win32",
        "arch": "x64",
        "url": "https://github.com/ast-grep/ast-grep/releases/download/0.45.3/app-x86_64-pc-windows-msvc.zip",
        "sha256": "3751b7d6be7fd39a80df1180ffe7e053903dcf92d3190e5a8336ff1746af9059",
        "commands": [
          {
            "command": "sg",
            "path": "sg.exe"
          },
          {
            "command": "ast-grep",
            "path": "ast-grep.exe"
          }
        ]
      },
      {
        "platform": "win32",
        "arch": "arm64",
        "url": "https://github.com/ast-grep/ast-grep/releases/download/0.45.3/app-aarch64-pc-windows-msvc.zip",
        "sha256": "5da748848c4cad2a1e7f41e27b58871714dd2c0908632f9874cc2833b92a21ca",
        "commands": [
          {
            "command": "sg",
            "path": "sg.exe"
          },
          {
            "command": "ast-grep",
            "path": "ast-grep.exe"
          }
        ]
      },
      {
        "platform": "linux",
        "arch": "x64",
        "url": "https://github.com/ast-grep/ast-grep/releases/download/0.45.3/app-x86_64-unknown-linux-gnu.zip",
        "sha256": "f8ac830881339d1edee6b2652f54798c0f4da5a827f2db38a08ee31117783ce8",
        "commands": [
          {
            "command": "sg",
            "path": "sg"
          },
          {
            "command": "ast-grep",
            "path": "ast-grep"
          }
        ]
      },
      {
        "platform": "linux",
        "arch": "arm64",
        "url": "https://github.com/ast-grep/ast-grep/releases/download/0.45.3/app-aarch64-unknown-linux-gnu.zip",
        "sha256": "b39cfbc58da4b869a88b8a4bc57bd5deb0d24541e704cf7c257da7b53ec81c8f",
        "commands": [
          {
            "command": "sg",
            "path": "sg"
          },
          {
            "command": "ast-grep",
            "path": "ast-grep"
          }
        ]
      },
      {
        "platform": "darwin",
        "arch": "x64",
        "url": "https://github.com/ast-grep/ast-grep/releases/download/0.45.3/app-x86_64-apple-darwin.zip",
        "sha256": "b2ffd26f42810340326a9e8a084bdc3647a8795c1a3f21fc06bd7bef3c7c5b2c",
        "commands": [
          {
            "command": "sg",
            "path": "sg"
          },
          {
            "command": "ast-grep",
            "path": "ast-grep"
          }
        ]
      },
      {
        "platform": "darwin",
        "arch": "arm64",
        "url": "https://github.com/ast-grep/ast-grep/releases/download/0.45.3/app-aarch64-apple-darwin.zip",
        "sha256": "6d2279dea5bea2ad79c66ea93f5fe54ba926e398a8a26de76c56db68fe59eac6",
        "commands": [
          {
            "command": "sg",
            "path": "sg"
          },
          {
            "command": "ast-grep",
            "path": "ast-grep"
          }
        ]
      }
    ]
  },
  "files": [
    {
      "path": "SKILL.md",
      "sha256": "5d70e5c98fc02a82976c0b11e3c0fa3c8770e24fd5df6104eae0178ccff9c81a"
    }
  ]
}
