{
  "schemaVersion": 1,
  "id": "kyne.duckdb",
  "name": "DuckDB",
  "version": "1.0.0",
  "description": "Managed DuckDB CLI integration for fast local SQL analysis and transformation of CSV, Parquet, JSON, and other tabular data.",
  "kind": "cli",
  "compatibility": {
    "relai": ">=1.1.3 <2.0.0"
  },
  "publisher": {
    "name": "Kyne",
    "url": "https://github.com/Kyne0328"
  },
  "repository": "https://github.com/Kyne0328/rel-ai-extensions",
  "permissions": [
    "workspace.read",
    "workspace.write",
    "command.execute"
  ],
  "homepage": "https://duckdb.org/",
  "requires": {
    "commands": [
      "duckdb"
    ],
    "platforms": []
  },
  "entrypoints": {
    "skill": "SKILL.md",
    "command": "duckdb"
  },
  "files": [
    {
      "path": "SKILL.md",
      "sha256": "0ba8f7e6792ca9be4e3af336743c8bf9769379736a31c5acfe980d17de5ee259"
    }
  ],
  "install": {
    "type": "bundle",
    "artifacts": [
      {
        "platform": "win32",
        "arch": "x64",
        "url": "https://github.com/duckdb/duckdb/releases/download/v1.5.5/duckdb_cli-windows-amd64.zip",
        "sha256": "e1428b7114a841626b5054723731cbf45c6df91b42ae1a6c355f88fad1f6dc4c",
        "commands": [
          {
            "command": "duckdb",
            "path": "duckdb.exe"
          }
        ]
      },
      {
        "platform": "win32",
        "arch": "arm64",
        "url": "https://github.com/duckdb/duckdb/releases/download/v1.5.5/duckdb_cli-windows-arm64.zip",
        "sha256": "9d0370d085684e1619ecc5efb2656cde930c50f1418380f0ae9d0379ddf06b12",
        "commands": [
          {
            "command": "duckdb",
            "path": "duckdb.exe"
          }
        ]
      },
      {
        "platform": "linux",
        "arch": "x64",
        "url": "https://github.com/duckdb/duckdb/releases/download/v1.5.5/duckdb_cli-linux-amd64.zip",
        "sha256": "08c0ca117111fcede14239d0093792352befdc174218c344d232c13279643d05",
        "commands": [
          {
            "command": "duckdb",
            "path": "duckdb"
          }
        ]
      },
      {
        "platform": "linux",
        "arch": "arm64",
        "url": "https://github.com/duckdb/duckdb/releases/download/v1.5.5/duckdb_cli-linux-arm64.zip",
        "sha256": "02163197027a42149147364d31fa67cac82108517a4be43304a1cc226eaef07a",
        "commands": [
          {
            "command": "duckdb",
            "path": "duckdb"
          }
        ]
      },
      {
        "platform": "darwin",
        "arch": "x64",
        "url": "https://github.com/duckdb/duckdb/releases/download/v1.5.5/duckdb_cli-osx-amd64.zip",
        "sha256": "47cbda17c5d4643a58833617dfae649a6a8722d7e54435a08161b98ac1c4e832",
        "commands": [
          {
            "command": "duckdb",
            "path": "duckdb"
          }
        ]
      },
      {
        "platform": "darwin",
        "arch": "arm64",
        "url": "https://github.com/duckdb/duckdb/releases/download/v1.5.5/duckdb_cli-osx-arm64.zip",
        "sha256": "da5177b8869c4ed8c65d514fb47a8ed0f6fa7427f103304932d5e83851e46abd",
        "commands": [
          {
            "command": "duckdb",
            "path": "duckdb"
          }
        ]
      }
    ]
  }
}
