{
  "schemaVersion": 1,
  "id": "kyne.camoufox",
  "name": "Camoufox Agent Browser",
  "version": "1.1.0",
  "description": "Optional Firefox-based agent browsing. After approval, Rel.AI automatically downloads Camoufox, reports live progress, and keeps isolated saved profiles.",
  "kind": "skill",
  "compatibility": {
    "relai": ">=1.2.0 <2.0.0"
  },
  "publisher": {
    "name": "Kyne",
    "url": "https://github.com/Kyne0328"
  },
  "repository": "https://github.com/Kyne0328/rel-ai-extensions",
  "permissions": [
    "workspace.read",
    "command.execute",
    "network",
    "browser"
  ],
  "requires": {
    "commands": [],
    "platforms": []
  },
  "entrypoints": {
    "skill": "SKILL.md"
  },
  "setup": {
    "type": "camoufox"
  },
  "files": [
    {
      "path": "SKILL.md",
      "sha256": "7846ca089d329183b4725e4723e1ac5cbe2c4533857d288df3fec85d7fac4697"
    },
    {
      "path": "scripts/browser.mjs",
      "sha256": "fa058293bac12ec5cede3c2ddf41762dd24bb0057e0f5425ccc5be0f9be0f272"
    }
  ]
}
