{
  "schemaVersion": 1,
  "id": "kyne.pdf-tools",
  "name": "PDF Tools",
  "version": "1.0.1",
  "description": "qpdf-based PDF structural tooling for checking, splitting, merging, selecting, rotating, linearizing, repairing, and inspecting PDF files.",
  "kind": "cli",
  "compatibility": {
    "relai": ">=1.1.3 <2.0.0"
  },
  "publisher": {
    "name": "Kyne",
    "url": "https://github.com/Kyne0328"
  },
  "repository": "https://github.com/Kyne0328/rel-ai-extensions",
  "permissions": [
    "workspace.read",
    "workspace.write",
    "command.execute"
  ],
  "homepage": "https://qpdf.readthedocs.io/",
  "requires": {
    "commands": [
      "qpdf"
    ],
    "platforms": []
  },
  "entrypoints": {
    "skill": "SKILL.md",
    "command": "qpdf"
  },
  "files": [
    {
      "path": "SKILL.md",
      "sha256": "fb2ff1ea43beb0140d1ca27e8d1206546be9d06984066d8ce07d2fa58bf791c3"
    }
  ],
  "install": {
    "type": "bundle",
    "artifacts": [
      {
        "platform": "win32",
        "arch": "x64",
        "url": "https://github.com/qpdf/qpdf/releases/download/v12.4.1/qpdf-12.4.1-msvc64.zip",
        "sha256": "3cd016cd433ef7232e42f4c13348a49cc14907a3c7278ef4f99120593126f7a6",
        "commands": [
          {
            "command": "qpdf",
            "path": "qpdf-12.4.1-msvc64/bin/qpdf.exe"
          }
        ]
      },
      {
        "platform": "linux",
        "arch": "x64",
        "url": "https://github.com/qpdf/qpdf/releases/download/v12.4.1/qpdf-12.4.1-bin-linux-x86_64.zip",
        "sha256": "db9122e88ec00c76ac6a14e09ffb92406db1773d47b968911ff6e69f28c09bf9",
        "commands": [
          {
            "command": "qpdf",
            "path": "bin/qpdf"
          }
        ]
      }
    ]
  }
}
