{
  "schemaVersion": 1,
  "id": "kyne.trivy",
  "name": "Trivy",
  "version": "1.0.0",
  "description": "Trivy integration for explicit local vulnerability, secret, filesystem, container, and configuration security scanning.",
  "kind": "cli",
  "compatibility": {
    "relai": ">=1.1.3 <2.0.0"
  },
  "publisher": {
    "name": "Kyne",
    "url": "https://github.com/Kyne0328"
  },
  "repository": "https://github.com/Kyne0328/rel-ai-extensions",
  "homepage": "https://trivy.dev/",
  "permissions": [
    "workspace.read",
    "command.execute",
    "network"
  ],
  "requires": {
    "commands": [
      "trivy"
    ],
    "platforms": []
  },
  "entrypoints": {
    "skill": "SKILL.md",
    "command": "trivy"
  },
  "files": [
    {
      "path": "SKILL.md",
      "sha256": "759928868c21ef81bdd59eabaa8e0e5a747c976f522cfac0ee19cff750fe10c3"
    }
  ]
}
