{
  "schemaVersion": 1,
  "id": "kyne.actionlint",
  "name": "Actionlint",
  "version": "1.0.1",
  "description": "Static validation for GitHub Actions workflow files with focused diagnostics for workflow syntax and expression errors.",
  "kind": "cli",
  "compatibility": {
    "relai": ">=1.1.3 <2.0.0"
  },
  "publisher": {
    "name": "Kyne",
    "url": "https://github.com/Kyne0328"
  },
  "repository": "https://github.com/Kyne0328/rel-ai-extensions",
  "homepage": "https://github.com/rhysd/actionlint",
  "permissions": [
    "workspace.read",
    "command.execute"
  ],
  "requires": {
    "commands": [
      "actionlint"
    ],
    "platforms": []
  },
  "entrypoints": {
    "skill": "SKILL.md",
    "command": "actionlint"
  },
  "install": {
    "type": "bundle",
    "artifacts": [
      {
        "platform": "win32",
        "arch": "x64",
        "url": "https://github.com/rhysd/actionlint/releases/download/v1.7.12/actionlint_1.7.12_windows_amd64.zip",
        "sha256": "6e7241b51e6817ea6a047693d8e6fed13b31819c9a0dd6c5a726e1592d22f6e9",
        "commands": [
          {
            "command": "actionlint",
            "path": "actionlint.exe"
          }
        ]
      },
      {
        "platform": "win32",
        "arch": "arm64",
        "url": "https://github.com/rhysd/actionlint/releases/download/v1.7.12/actionlint_1.7.12_windows_arm64.zip",
        "sha256": "cadcf7ea4efe3a68728893813643cebe1185e5b1d4be5b96245f65c9a4d5ea41",
        "commands": [
          {
            "command": "actionlint",
            "path": "actionlint.exe"
          }
        ]
      },
      {
        "platform": "darwin",
        "arch": "x64",
        "url": "https://github.com/rhysd/actionlint/releases/download/v1.7.12/actionlint_1.7.12_darwin_amd64.tar.gz",
        "sha256": "5b44c3bc2255115c9b69e30efc0fecdf498fdb63c5d58e17084fd5f16324c644",
        "commands": [
          {
            "command": "actionlint",
            "path": "actionlint"
          }
        ]
      },
      {
        "platform": "darwin",
        "arch": "arm64",
        "url": "https://github.com/rhysd/actionlint/releases/download/v1.7.12/actionlint_1.7.12_darwin_arm64.tar.gz",
        "sha256": "aba9ced2dee8d27fecca3dc7feb1a7f9a52caefa1eb46f3271ea66b6e0e6953f",
        "commands": [
          {
            "command": "actionlint",
            "path": "actionlint"
          }
        ]
      },
      {
        "platform": "linux",
        "arch": "x64",
        "url": "https://github.com/rhysd/actionlint/releases/download/v1.7.12/actionlint_1.7.12_linux_amd64.tar.gz",
        "sha256": "8aca8db96f1b94770f1b0d72b6dddcb1ebb8123cb3712530b08cc387b349a3d8",
        "commands": [
          {
            "command": "actionlint",
            "path": "actionlint"
          }
        ]
      },
      {
        "platform": "linux",
        "arch": "arm64",
        "url": "https://github.com/rhysd/actionlint/releases/download/v1.7.12/actionlint_1.7.12_linux_arm64.tar.gz",
        "sha256": "325e971b6ba9bfa504672e29be93c24981eeb1c07576d730e9f7c8805afff0c6",
        "commands": [
          {
            "command": "actionlint",
            "path": "actionlint"
          }
        ]
      }
    ]
  },
  "files": [
    {
      "path": "SKILL.md",
      "sha256": "fa4a556774968638497090f930bc50903619e72c51b19dcf76bc6bea02d79598"
    }
  ]
}
