{
  "schemaVersion": 1,
  "id": "kyne.exiftool",
  "name": "ExifTool",
  "version": "1.0.0",
  "description": "ExifTool integration for reading, comparing, removing, copying, renaming from, and updating EXIF, GPS, XMP, IPTC, QuickTime, and other file metadata.",
  "kind": "cli",
  "compatibility": {
    "relai": ">=1.1.3 <2.0.0"
  },
  "publisher": {
    "name": "Kyne",
    "url": "https://github.com/Kyne0328"
  },
  "repository": "https://github.com/Kyne0328/rel-ai-extensions",
  "permissions": [
    "workspace.read",
    "workspace.write",
    "command.execute"
  ],
  "homepage": "https://exiftool.org/",
  "requires": {
    "commands": [
      "exiftool"
    ],
    "platforms": []
  },
  "entrypoints": {
    "skill": "SKILL.md",
    "command": "exiftool"
  },
  "files": [
    {
      "path": "SKILL.md",
      "sha256": "7ccb92b97c273349ac8231c00d2079cf7f513fad53c8da3eea6a329dde8528a6"
    }
  ],
  "install": {
    "type": "bundle",
    "artifacts": [
      {
        "platform": "win32",
        "arch": "x64",
        "url": "https://downloads.sourceforge.net/project/exiftool/exiftool-13.58_64.zip",
        "sha256": "fd3b407a01e6ffc6160f2d5fde5ff0c003f6c4c2ba85eee1ce8928ccb51fa3e6",
        "commands": [
          {
            "command": "exiftool",
            "path": "exiftool-13.58_64/exiftool(-k).exe"
          }
        ]
      }
    ]
  }
}
